{"schemaVersion":"1.0","id":"m10-volcanic-forge-edge-stacks","version":"0.1.0","status":"approved","presets":[{"id":"m10-forged-heavy","version":"1.0.0","layers":[{"id":"outer-shadow","order":0,"inset":0,"thickness":5,"opacity":0.78,"color":"#130807"},{"id":"structural-silhouette","order":1,"inset":1,"thickness":3,"opacity":1,"color":"#2C1A16"},{"id":"dark-bevel","order":2,"inset":4,"thickness":2,"opacity":0.9,"color":"#4A2A1A"},{"id":"bright-bevel","order":3,"inset":6,"thickness":2,"opacity":0.86,"color":"#D7943A"},{"id":"inner-rim","order":4,"inset":9,"thickness":1,"opacity":0.52,"color":"#FFB95A"}]},{"id":"m10-obsidian-inset","version":"1.0.0","layers":[{"id":"outer-shadow","order":0,"inset":0,"thickness":5,"opacity":0.8,"color":"#120807"},{"id":"structural-silhouette","order":1,"inset":1,"thickness":3,"opacity":1,"color":"#211411"},{"id":"body-material","order":2,"inset":4,"thickness":3,"opacity":0.9,"color":"#351F19"},{"id":"inner-shadow","order":3,"inset":7,"thickness":2,"opacity":0.7,"color":"#080404"},{"id":"inner-rim","order":4,"inset":10,"thickness":1,"opacity":0.5,"color":"#A85A22"}]}],"bindings":[{"componentId":"primary-hex-button","presetId":"m10-forged-heavy"},{"componentId":"secondary-hex-button","presetId":"m10-forged-heavy"},{"componentId":"panel","presetId":"m10-obsidian-inset"},{"componentId":"tab","presetId":"m10-forged-heavy"},{"componentId":"badge","presetId":"m10-forged-heavy"},{"componentId":"progress","presetId":"m10-obsidian-inset"},{"componentId":"icon-container","presetId":"m10-forged-heavy"}],"compatibility":{"minimumRendererVersion":"0.1.0","migrationNote":"M10 consumes the shared edge-stack contract without geometry changes."}}
