{"schemaVersion":"1.0","id":"m11-enchanted-forest-edge-stacks","version":"0.1.0","status":"approved","presets":[{"id":"m11-weathered-stone-edge","version":"1.0.0","layers":[{"id":"outer-shadow","order":0,"inset":0,"thickness":5,"opacity":0.76,"color":"#0C1A14"},{"id":"structural-silhouette","order":1,"inset":1,"thickness":3,"opacity":1,"color":"#20362A"},{"id":"dark-bevel","order":2,"inset":4,"thickness":2,"opacity":0.82,"color":"#486B50"},{"id":"bright-bevel","order":3,"inset":7,"thickness":2,"opacity":0.64,"color":"#7BAF6C"},{"id":"inner-rim","order":4,"inset":10,"thickness":1,"opacity":0.48,"color":"#584630"}]},{"id":"m11-dark-wood-inset","version":"1.0.0","layers":[{"id":"outer-shadow","order":0,"inset":0,"thickness":5,"opacity":0.8,"color":"#0C1A14"},{"id":"structural-silhouette","order":1,"inset":1,"thickness":3,"opacity":1,"color":"#30291F"},{"id":"body-material","order":2,"inset":4,"thickness":3,"opacity":0.9,"color":"#4E4431"},{"id":"inner-shadow","order":3,"inset":7,"thickness":2,"opacity":0.7,"color":"#151A12"},{"id":"inner-rim","order":4,"inset":10,"thickness":1,"opacity":0.5,"color":"#6E8C5D"}]}],"bindings":[{"componentId":"primary-hex-button","presetId":"m11-weathered-stone-edge"},{"componentId":"secondary-hex-button","presetId":"m11-weathered-stone-edge"},{"componentId":"panel","presetId":"m11-dark-wood-inset"},{"componentId":"tab","presetId":"m11-weathered-stone-edge"},{"componentId":"badge","presetId":"m11-weathered-stone-edge"},{"componentId":"progress","presetId":"m11-dark-wood-inset"},{"componentId":"icon-container","presetId":"m11-weathered-stone-edge"}],"compatibility":{"minimumRendererVersion":"0.1.0","migrationNote":"Shared geometry only."}}
